{
  "$schema": "https://json-schema.org/draft/2020-12/schema",
  "$id": "urn:kg-ninja:security-evidence:2.0.0",
  "title": "KG-NINJA security evidence 2.0.0",
  "description": "Versioned artifact contract only. Schema validity and hashes do not establish authenticity or authorize execution.",
  "type": "object",
  "additionalProperties": false,
  "required": [
    "schema_version",
    "event_id",
    "observed_at",
    "source_type",
    "assessment_id",
    "finding_type",
    "severity",
    "evidence",
    "confidence",
    "limitations",
    "remediation",
    "content_hash"
  ],
  "properties": {
    "schema_version": {
      "const": "2.0.0"
    },
    "event_id": {
      "type": "string",
      "pattern": "^[0-9a-f]{64}$"
    },
    "observed_at": {
      "type": "string",
      "format": "date-time",
      "pattern": "^\\d{4}-\\d{2}-\\d{2}T\\d{2}:\\d{2}:\\d{2}\\.\\d{3}Z$"
    },
    "source_type": {
      "enum": [
        "mcp_honeypot",
        "submitted_mcp_metadata"
      ]
    },
    "assessment_id": {
      "type": "string",
      "minLength": 1,
      "maxLength": 128
    },
    "finding_type": {
      "type": "string",
      "minLength": 1,
      "maxLength": 64,
      "pattern": "^[a-z][a-z0-9_]*$"
    },
    "severity": {
      "enum": [
        "info",
        "low",
        "medium",
        "high",
        "critical"
      ]
    },
    "evidence": {
      "type": "object"
    },
    "confidence": {
      "type": "object"
    },
    "limitations": {
      "type": "array",
      "minItems": 1,
      "maxItems": 16,
      "items": {
        "type": "string",
        "minLength": 1,
        "maxLength": 512
      }
    },
    "remediation": {
      "type": "string",
      "minLength": 1,
      "maxLength": 1024
    },
    "content_hash": {
      "type": "string",
      "pattern": "^sha256:[0-9a-f]{64}$"
    }
  },
  "oneOf": [
    {
      "properties": {
        "source_type": {
          "const": "mcp_honeypot"
        },
        "finding_type": {
          "enum": [
            "possible_prompt_injection",
            "invalid_authentication",
            "anomalous_sequence",
            "malformed_request"
          ]
        },
        "severity": {
          "enum": [
            "low",
            "medium"
          ]
        },
        "evidence": {
          "type": "object",
          "additionalProperties": false,
          "required": [
            "indicators"
          ],
          "properties": {
            "indicators": {
              "type": "array",
              "minItems": 1,
              "maxItems": 16,
              "items": {
                "type": "string",
                "minLength": 1,
                "maxLength": 64
              },
              "uniqueItems": true
            },
            "preview": {
              "type": "string",
              "minLength": 0,
              "maxLength": 256
            }
          }
        },
        "confidence": {
          "type": "object",
          "additionalProperties": false,
          "required": [
            "scale",
            "value"
          ],
          "properties": {
            "scale": {
              "const": "heuristic_score"
            },
            "value": {
              "type": "number",
              "minimum": 0,
              "maximum": 1
            }
          }
        }
      }
    },
    {
      "properties": {
        "source_type": {
          "const": "submitted_mcp_metadata"
        },
        "evidence": {
          "type": "object",
          "additionalProperties": false,
          "required": [
            "path",
            "observation"
          ],
          "properties": {
            "path": {
              "type": "string",
              "minLength": 0,
              "maxLength": 512,
              "pattern": "^(?:/(?:[^~/]|~[01])*)*$"
            },
            "observation": {
              "type": "string",
              "minLength": 1,
              "maxLength": 1024
            }
          }
        },
        "confidence": {
          "type": "object",
          "additionalProperties": false,
          "required": [
            "scale",
            "value"
          ],
          "properties": {
            "scale": {
              "const": "ordinal"
            },
            "value": {
              "enum": [
                "low",
                "medium",
                "high"
              ]
            }
          }
        }
      }
    }
  ]
}
